20:00:44.670596 IP ip-172-31-26-60.ec2.internal.ssh > nat-130-245-192-31.resnet.stonybrook.edu.1997: Flags [P.], seq 2142839642:2142839750, ack 3721697300, win 283, options [nop,nop,TS val 542730390 ecr 1269622118], length 108
20:00:44.670803 IP ip-172-31-26-60.ec2.internal.ssh > nat-130-245-192-31.resnet.stonybrook.edu.1997: Flags [P.], seq 108:144, ack 1, win 283, options [nop,nop,TS val 542730391 ecr 1269622118], length 36
20:00:44.670839 IP ip-172-31-26-60.ec2.internal.ssh > nat-130-245-192-31.resnet.stonybrook.edu.1997: Flags [P.], seq 144:252, ack 1, win 283, options [nop,nop,TS val 542730391 ecr 1269622118], length 108
20:00:44.670862 IP ip-172-31-26-60.ec2.internal.ssh > nat-130-245-192-31.resnet.stonybrook.edu.1997: Flags [P.], seq 252:288, ack 1, win 283, options [nop,nop,TS val 542730391 ecr 1269622118], length 36
20:00:44.682282 IP nat-130-245-192-31.resnet.stonybrook.edu.1997 > ip-172-31-26-60.ec2.internal.ssh: Flags [.], ack 108, win 14801, options [nop,nop,TS val 1269622138 ecr 542730390], length 0
20:00:44.682292 IP nat-130-245-192-31.resnet.stonybrook.edu.1997 > ip-172-31-26-60.ec2.internal.ssh: Flags [.], ack 144, win 14800, options [nop,nop,TS val 1269622138 ecr 542730391], length 0
20:00:44.682852 IP nat-130-245-192-31.resnet.stonybrook.edu.1997 > ip-172-31-26-60.ec2.internal.ssh: Flags [.], ack 252, win 14801, options [nop,nop,TS val 1269622138 ecr 542730391], length 0
20:00:44.682858 IP nat-130-245-192-31.resnet.stonybrook.edu.1997 > ip-172-31-26-60.ec2.internal.ssh: Flags [.], ack 288, win 14800, options [nop,nop,TS val 1269622138 ecr 542730391], length 0
20:00:45.183999 IP nat-130-245-192-27.resnet.stonybrook.edu.29743 > ip-172-31-26-60.ec2.internal.1337: Flags [S], seq 1245871409, win 29200, options [mss 1386,sackOK,TS val 14847135 ecr 0,nop,wscale 6], length 0
20:00:45.184064 IP ip-172-31-26-60.ec2.internal.1337 > nat-130-245-192-27.resnet.stonybrook.edu.29743: Flags [R.], seq 0, ack 1245871410, win 0, length 0
20:00:45.370421 IP nat-130-245-192-27.resnet.stonybrook.edu.36128 > ip-172-31-26-60.ec2.internal.1337: Flags [S], seq 3607288830, win 29200, options [mss 1386,sackOK,TS val 14847153 ecr 0,nop,wscale 6], length 0
20:00:45.370470 IP ip-172-31-26-60.ec2.internal.1337 > nat-130-245-192-27.resnet.stonybrook.edu.36128: Flags [R.], seq 0, ack 3607288831, win 0, length 0
20:00:45.667627 IP ip-172-31-26-60.ec2.internal.58962 > ip-172-31-0-2.ec2.internal.domain: 43338+ PTR? 31.192.245.130.in-addr.arpa. (45)
20:00:45.761176 IP ip-172-31-0-2.ec2.internal.domain > ip-172-31-26-60.ec2.internal.58962: 43338 1/0/0 PTR nat-130-245-192-31.resnet.stonybrook.edu. (99)
20:00:45.761307 IP ip-172-31-26-60.ec2.internal.60981 > ip-172-31-0-2.ec2.internal.domain: 60619+ PTR? 60.26.31.172.in-addr.arpa. (43)
20:00:45.762357 IP ip-172-31-0-2.ec2.internal.domain > ip-172-31-26-60.ec2.internal.60981: 60619 1/0/0 PTR ip-172-31-26-60.ec2.internal. (85)
20:00:45.762544 IP ip-172-31-26-60.ec2.internal.33659 > ip-172-31-0-2.ec2.internal.domain: 57949+ PTR? 27.192.245.130.in-addr.arpa. (45)
20:00:45.846300 IP ip-172-31-0-2.ec2.internal.domain > ip-172-31-26-60.ec2.internal.33659: 57949 1/0/0 PTR nat-130-245-192-27.resnet.stonybrook.edu. (99)
20:00:46.207539 IP nat-130-245-192-27.resnet.stonybrook.edu.16554 > ip-172-31-26-60.ec2.internal.1337: Flags [S], seq 3006360357, win 29200, options [mss 1386,sackOK,TS val 14847237 ecr 0,nop,wscale 6], length 0
20:00:46.207591 IP ip-172-31-26-60.ec2.internal.1337 > nat-130-245-192-27.resnet.stonybrook.edu.16554: Flags [R.], seq 0, ack 3006360358, win 0, length 0
20:00:46.396522 IP nat-130-245-192-27.resnet.stonybrook.edu.7322 > ip-172-31-26-60.ec2.internal.1337: Flags [S], seq 556124398, win 29200, options [mss 1386,sackOK,TS val 14847256 ecr 0,nop,wscale 6], length 0
20:00:46.396558 IP ip-172-31-26-60.ec2.internal.1337 > nat-130-245-192-27.resnet.stonybrook.edu.7322: Flags [R.], seq 0, ack 556124399, win 0, length 0
20:00:46.666770 IP ip-172-31-26-60.ec2.internal.36867 > ip-172-31-0-2.ec2.internal.domain: 58046+ PTR? 2.0.31.172.in-addr.arpa. (41)
20:00:46.668081 IP ip-172-31-0-2.ec2.internal.domain > ip-172-31-26-60.ec2.internal.36867: 58046 1/0/0 PTR ip-172-31-0-2.ec2.internal. (81)
20:00:47.269687 IP nat-130-245-192-27.resnet.stonybrook.edu.5874 > ip-172-31-26-60.ec2.internal.1337: Flags [S], seq 3796277436, win 29200, options [mss 1386,sackOK,TS val 14847343 ecr 0,nop,wscale 6], length 0
20:00:47.269743 IP ip-172-31-26-60.ec2.internal.1337 > nat-130-245-192-27.resnet.stonybrook.edu.5874: Flags [R.], seq 0, ack 3796277437, win 0, length 0
20:00:47.449518 IP nat-130-245-192-27.resnet.stonybrook.edu.10409 > ip-172-31-26-60.ec2.internal.1337: Flags [S], seq 1652831062, win 29200, options [mss 1386,sackOK,TS val 14847361 ecr 0,nop,wscale 6], length 0
20:00:47.449554 IP ip-172-31-26-60.ec2.internal.1337 > nat-130-245-192-27.resnet.stonybrook.edu.10409: Flags [R.], seq 0, ack 1652831063, win 0, length 0
20:00:48.297965 IP nat-130-245-192-27.resnet.stonybrook.edu.16695 > ip-172-31-26-60.ec2.internal.1337: Flags [S], seq 2106150689, win 29200, options [mss 1386,sackOK,TS val 14847446 ecr 0,nop,wscale 6], length 0
20:00:48.298004 IP ip-172-31-26-60.ec2.internal.1337 > nat-130-245-192-27.resnet.stonybrook.edu.16695: Flags [R.], seq 0, ack 2106150690, win 0, length 0
20:00:48.476922 IP nat-130-245-192-27.resnet.stonybrook.edu.38849 > ip-172-31-26-60.ec2.internal.1337: Flags [S], seq 2679135095, win 29200, options [mss 1386,sackOK,TS val 14847464 ecr 0,nop,wscale 6], length 0
20:00:48.476962 IP ip-172-31-26-60.ec2.internal.1337 > nat-130-245-192-27.resnet.stonybrook.edu.38849: Flags [R.], seq 0, ack 2679135096, win 0, length 0
20:00:49.330354 IP nat-130-245-192-27.resnet.stonybrook.edu.20240 > ip-172-31-26-60.ec2.internal.1337: Flags [S], seq 4170149098, win 29200, options [mss 1386,sackOK,TS val 14847549 ecr 0,nop,wscale 6], length 0
20:00:49.330391 IP ip-172-31-26-60.ec2.internal.1337 > nat-130-245-192-27.resnet.stonybrook.edu.20240: Flags [R.], seq 0, ack 4170149099, win 0, length 0
20:00:49.521737 IP nat-130-245-192-27.resnet.stonybrook.edu.33874 > ip-172-31-26-60.ec2.internal.1337: Flags [S], seq 4038357361, win 29200, options [mss 1386,sackOK,TS val 14847567 ecr 0,nop,wscale 6], length 0
20:00:49.521775 IP ip-172-31-26-60.ec2.internal.1337 > nat-130-245-192-27.resnet.stonybrook.edu.33874: Flags [R.], seq 0, ack 4038357362, win 0, length 0
20:00:50.385071 IP nat-130-245-192-27.resnet.stonybrook.edu.42257 > ip-172-31-26-60.ec2.internal.1337: Flags [S], seq 29794364, win 29200, options [mss 1386,sackOK,TS val 14847653 ecr 0,nop,wscale 6], length 0
20:00:50.385110 IP ip-172-31-26-60.ec2.internal.1337 > nat-130-245-192-27.resnet.stonybrook.edu.42257: Flags [R.], seq 0, ack 29794365, win 0, length 0
20:00:50.550033 IP nat-130-245-192-27.resnet.stonybrook.edu.36378 > ip-172-31-26-60.ec2.internal.1337: Flags [S], seq 3439597006, win 29200, options [mss 1386,sackOK,TS val 14847671 ecr 0,nop,wscale 6], length 0
20:00:50.550071 IP ip-172-31-26-60.ec2.internal.1337 > nat-130-245-192-27.resnet.stonybrook.edu.36378: Flags [R.], seq 0, ack 3439597007, win 0, length 0
20:00:51.411631 IP nat-130-245-192-27.resnet.stonybrook.edu.42773 > ip-172-31-26-60.ec2.internal.1337: Flags [S], seq 2663673287, win 29200, options [mss 1386,sackOK,TS val 14847758 ecr 0,nop,wscale 6], length 0
20:00:51.411667 IP ip-172-31-26-60.ec2.internal.1337 > nat-130-245-192-27.resnet.stonybrook.edu.42773: Flags [R.], seq 0, ack 2663673288, win 0, length 0
20:00:51.573839 IP nat-130-245-192-27.resnet.stonybrook.edu.9239 > ip-172-31-26-60.ec2.internal.1337: Flags [S], seq 1585247376, win 29200, options [mss 1386,sackOK,TS val 14847774 ecr 0,nop,wscale 6], length 0
20:00:51.573878 IP ip-172-31-26-60.ec2.internal.1337 > nat-130-245-192-27.resnet.stonybrook.edu.9239: Flags [R.], seq 0, ack 1585247377, win 0, length 0
20:00:52.434859 IP nat-130-245-192-27.resnet.stonybrook.edu.7815 > ip-172-31-26-60.ec2.internal.1337: Flags [S], seq 3428545090, win 29200, options [mss 1386,sackOK,TS val 14847860 ecr 0,nop,wscale 6], length 0
20:00:52.434898 IP ip-172-31-26-60.ec2.internal.1337 > nat-130-245-192-27.resnet.stonybrook.edu.7815: Flags [R.], seq 0, ack 3428545091, win 0, length 0
20:00:52.597084 IP nat-130-245-192-27.resnet.stonybrook.edu.4920 > ip-172-31-26-60.ec2.internal.1337: Flags [S], seq 1410880590, win 29200, options [mss 1386,sackOK,TS val 14847876 ecr 0,nop,wscale 6], length 0
20:00:52.597124 IP ip-172-31-26-60.ec2.internal.1337 > nat-130-245-192-27.resnet.stonybrook.edu.4920: Flags [R.], seq 0, ack 1410880591, win 0, length 0
20:00:53.504835 IP nat-130-245-192-27.resnet.stonybrook.edu.11996 > ip-172-31-26-60.ec2.internal.1337: Flags [S], seq 4289913389, win 29200, options [mss 1386,sackOK,TS val 14847967 ecr 0,nop,wscale 6], length 0
20:00:53.504894 IP ip-172-31-26-60.ec2.internal.1337 > nat-130-245-192-27.resnet.stonybrook.edu.11996: Flags [R.], seq 0, ack 4289913390, win 0, length 0
20:00:53.621429 IP nat-130-245-192-27.resnet.stonybrook.edu.18355 > ip-172-31-26-60.ec2.internal.1337: Flags [S], seq 1231021899, win 29200, options [mss 1386,sackOK,TS val 14847978 ecr 0,nop,wscale 6], length 0
20:00:53.621465 IP ip-172-31-26-60.ec2.internal.1337 > nat-130-245-192-27.resnet.stonybrook.edu.18355: Flags [R.], seq 0, ack 1231021900, win 0, length 0
20:00:54.527711 IP nat-130-245-192-27.resnet.stonybrook.edu.4726 > ip-172-31-26-60.ec2.internal.1337: Flags [S], seq 119199194, win 29200, options [mss 1386,sackOK,TS val 14848069 ecr 0,nop,wscale 6], length 0
20:00:54.527749 IP ip-172-31-26-60.ec2.internal.1337 > nat-130-245-192-27.resnet.stonybrook.edu.4726: Flags [R.], seq 0, ack 119199195, win 0, length 0
20:00:54.642585 IP nat-130-245-192-27.resnet.stonybrook.edu.23114 > ip-172-31-26-60.ec2.internal.1337: Flags [S], seq 669356278, win 29200, options [mss 1386,sackOK,TS val 14848081 ecr 0,nop,wscale 6], length 0
20:00:54.642622 IP ip-172-31-26-60.ec2.internal.1337 > nat-130-245-192-27.resnet.stonybrook.edu.23114: Flags [R.], seq 0, ack 669356279, win 0, length 0
20:00:55.563073 IP nat-130-245-192-27.resnet.stonybrook.edu.16599 > ip-172-31-26-60.ec2.internal.1337: Flags [S], seq 2188611230, win 29200, options [mss 1386,sackOK,TS val 14848171 ecr 0,nop,wscale 6], length 0
20:00:55.563110 IP ip-172-31-26-60.ec2.internal.1337 > nat-130-245-192-27.resnet.stonybrook.edu.16599: Flags [R.], seq 0, ack 2188611231, win 0, length 0
20:00:55.672687 IP nat-130-245-192-27.resnet.stonybrook.edu.30129 > ip-172-31-26-60.ec2.internal.1337: Flags [S], seq 1257918389, win 29200, options [mss 1386,sackOK,TS val 14848183 ecr 0,nop,wscale 6], length 0
20:00:55.672723 IP ip-172-31-26-60.ec2.internal.1337 > nat-130-245-192-27.resnet.stonybrook.edu.30129: Flags [R.], seq 0, ack 1257918390, win 0, length 0
20:00:56.590787 IP nat-130-245-192-27.resnet.stonybrook.edu.3633 > ip-172-31-26-60.ec2.internal.1337: Flags [S], seq 2824626426, win 29200, options [mss 1386,sackOK,TS val 14848275 ecr 0,nop,wscale 6], length 0
20:00:56.590825 IP ip-172-31-26-60.ec2.internal.1337 > nat-130-245-192-27.resnet.stonybrook.edu.3633: Flags [R.], seq 0, ack 2824626427, win 0, length 0
20:00:56.696664 IP nat-130-245-192-27.resnet.stonybrook.edu.7119 > ip-172-31-26-60.ec2.internal.1337: Flags [S], seq 3545887632, win 29200, options [mss 1386,sackOK,TS val 14848286 ecr 0,nop,wscale 6], length 0
20:00:56.696700 IP ip-172-31-26-60.ec2.internal.1337 > nat-130-245-192-27.resnet.stonybrook.edu.7119: Flags [R.], seq 0, ack 3545887633, win 0, length 0
20:00:57.611754 IP nat-130-245-192-27.resnet.stonybrook.edu.39983 > ip-172-31-26-60.ec2.internal.1337: Flags [S], seq 122571734, win 29200, options [mss 1386,sackOK,TS val 14848378 ecr 0,nop,wscale 6], length 0
20:00:57.611808 IP ip-172-31-26-60.ec2.internal.1337 > nat-130-245-192-27.resnet.stonybrook.edu.39983: Flags [R.], seq 0, ack 122571735, win 0, length 0
20:00:57.721952 IP nat-130-245-192-27.resnet.stonybrook.edu.25025 > ip-172-31-26-60.ec2.internal.1337: Flags [S], seq 544368035, win 29200, options [mss 1386,sackOK,TS val 14848389 ecr 0,nop,wscale 6], length 0
20:00:57.721990 IP ip-172-31-26-60.ec2.internal.1337 > nat-130-245-192-27.resnet.stonybrook.edu.25025: Flags [R.], seq 0, ack 544368036, win 0, length 0
20:00:58.634943 IP nat-130-245-192-27.resnet.stonybrook.edu.5620 > ip-172-31-26-60.ec2.internal.1337: Flags [S], seq 2986807049, win 29200, options [mss 1386,sackOK,TS val 14848480 ecr 0,nop,wscale 6], length 0
20:00:58.634991 IP ip-172-31-26-60.ec2.internal.1337 > nat-130-245-192-27.resnet.stonybrook.edu.5620: Flags [R.], seq 0, ack 2986807050, win 0, length 0
20:00:58.771498 IP nat-130-245-192-27.resnet.stonybrook.edu.2486 > ip-172-31-26-60.ec2.internal.1337: Flags [S], seq 3042641750, win 29200, options [mss 1386,sackOK,TS val 14848491 ecr 0,nop,wscale 6], length 0
20:00:58.771534 IP ip-172-31-26-60.ec2.internal.1337 > nat-130-245-192-27.resnet.stonybrook.edu.2486: Flags [R.], seq 0, ack 3042641751, win 0, length 0
20:00:59.659067 IP nat-130-245-192-27.resnet.stonybrook.edu.44752 > ip-172-31-26-60.ec2.internal.1337: Flags [S], seq 1576534614, win 29200, options [mss 1386,sackOK,TS val 14848582 ecr 0,nop,wscale 6], length 0
20:00:59.659104 IP ip-172-31-26-60.ec2.internal.1337 > nat-130-245-192-27.resnet.stonybrook.edu.44752: Flags [R.], seq 0, ack 1576534615, win 0, length 0
20:00:59.798374 IP nat-130-245-192-27.resnet.stonybrook.edu.35127 > ip-172-31-26-60.ec2.internal.1337: Flags [S], seq 230082991, win 29200, options [mss 1386,sackOK,TS val 14848596 ecr 0,nop,wscale 6], length 0
20:00:59.798410 IP ip-172-31-26-60.ec2.internal.1337 > nat-130-245-192-27.resnet.stonybrook.edu.35127: Flags [R.], seq 0, ack 230082992, win 0, length 0
20:01:00.678820 IP nat-130-245-192-27.resnet.stonybrook.edu.21941 > ip-172-31-26-60.ec2.internal.1337: Flags [S], seq 1076748475, win 29200, options [mss 1386,sackOK,TS val 14848685 ecr 0,nop,wscale 6], length 0
20:01:00.678859 IP ip-172-31-26-60.ec2.internal.1337 > nat-130-245-192-27.resnet.stonybrook.edu.21941: Flags [R.], seq 0, ack 1076748476, win 0, length 0
20:01:00.821362 IP nat-130-245-192-27.resnet.stonybrook.edu.33411 > ip-172-31-26-60.ec2.internal.1337: Flags [S], seq 1206150537, win 29200, options [mss 1386,sackOK,TS val 14848698 ecr 0,nop,wscale 6], length 0
20:01:00.821395 IP ip-172-31-26-60.ec2.internal.1337 > nat-130-245-192-27.resnet.stonybrook.edu.33411: Flags [R.], seq 0, ack 1206150538, win 0, length 0
20:01:01.730760 IP nat-130-245-192-27.resnet.stonybrook.edu.40784 > ip-172-31-26-60.ec2.internal.1337: Flags [S], seq 3484671877, win 29200, options [mss 1386,sackOK,TS val 14848787 ecr 0,nop,wscale 6], length 0
20:01:01.730798 IP ip-172-31-26-60.ec2.internal.1337 > nat-130-245-192-27.resnet.stonybrook.edu.40784: Flags [R.], seq 0, ack 3484671878, win 0, length 0
20:01:01.845435 IP nat-130-245-192-27.resnet.stonybrook.edu.37093 > ip-172-31-26-60.ec2.internal.1337: Flags [S], seq 2932353235, win 29200, options [mss 1386,sackOK,TS val 14848801 ecr 0,nop,wscale 6], length 0
20:01:01.845472 IP ip-172-31-26-60.ec2.internal.1337 > nat-130-245-192-27.resnet.stonybrook.edu.37093: Flags [R.], seq 0, ack 2932353236, win 0, length 0
20:01:02.757230 IP nat-130-245-192-27.resnet.stonybrook.edu.8550 > ip-172-31-26-60.ec2.internal.1337: Flags [S], seq 174910651, win 29200, options [mss 1386,sackOK,TS val 14848892 ecr 0,nop,wscale 6], length 0
20:01:02.757269 IP ip-172-31-26-60.ec2.internal.1337 > nat-130-245-192-27.resnet.stonybrook.edu.8550: Flags [R.], seq 0, ack 174910652, win 0, length 0
20:01:02.868652 IP nat-130-245-192-27.resnet.stonybrook.edu.18042 > ip-172-31-26-60.ec2.internal.1337: Flags [S], seq 2073888055, win 29200, options [mss 1386,sackOK,TS val 14848903 ecr 0,nop,wscale 6], length 0
20:01:02.868690 IP ip-172-31-26-60.ec2.internal.1337 > nat-130-245-192-27.resnet.stonybrook.edu.18042: Flags [R.], seq 0, ack 2073888056, win 0, length 0
20:01:03.808418 IP nat-130-245-192-27.resnet.stonybrook.edu.14951 > ip-172-31-26-60.ec2.internal.1337: Flags [S], seq 187892925, win 29200, options [mss 1386,sackOK,TS val 14848997 ecr 0,nop,wscale 6], length 0
20:01:03.808459 IP ip-172-31-26-60.ec2.internal.1337 > nat-130-245-192-27.resnet.stonybrook.edu.14951: Flags [R.], seq 0, ack 187892926, win 0, length 0
20:01:03.895902 IP nat-130-245-192-27.resnet.stonybrook.edu.36357 > ip-172-31-26-60.ec2.internal.1337: Flags [S], seq 10758536, win 29200, options [mss 1386,sackOK,TS val 14849006 ecr 0,nop,wscale 6], length 0
20:01:03.895942 IP ip-172-31-26-60.ec2.internal.1337 > nat-130-245-192-27.resnet.stonybrook.edu.36357: Flags [R.], seq 0, ack 10758537, win 0, length 0
20:01:04.850799 IP nat-130-245-192-27.resnet.stonybrook.edu.8735 > ip-172-31-26-60.ec2.internal.1337: Flags [S], seq 3613248312, win 29200, options [mss 1386,sackOK,TS val 14849101 ecr 0,nop,wscale 6], length 0
20:01:04.850844 IP ip-172-31-26-60.ec2.internal.1337 > nat-130-245-192-27.resnet.stonybrook.edu.8735: Flags [R.], seq 0, ack 3613248313, win 0, length 0
20:01:04.927654 IP nat-130-245-192-27.resnet.stonybrook.edu.36058 > ip-172-31-26-60.ec2.internal.1337: Flags [S], seq 3209994693, win 29200, options [mss 1386,sackOK,TS val 14849109 ecr 0,nop,wscale 6], length 0
20:01:04.927692 IP ip-172-31-26-60.ec2.internal.1337 > nat-130-245-192-27.resnet.stonybrook.edu.36058: Flags [R.], seq 0, ack 3209994694, win 0, length 0
20:01:05.874913 IP nat-130-245-192-27.resnet.stonybrook.edu.38242 > ip-172-31-26-60.ec2.internal.1337: Flags [S], seq 1254254604, win 29200, options [mss 1386,sackOK,TS val 14849204 ecr 0,nop,wscale 6], length 0
20:01:05.874950 IP ip-172-31-26-60.ec2.internal.1337 > nat-130-245-192-27.resnet.stonybrook.edu.38242: Flags [R.], seq 0, ack 1254254605, win 0, length 0
20:01:05.997118 IP nat-130-245-192-27.resnet.stonybrook.edu.44318 > ip-172-31-26-60.ec2.internal.1337: Flags [S], seq 2687153883, win 29200, options [mss 1386,sackOK,TS val 14849215 ecr 0,nop,wscale 6], length 0
20:01:05.997155 IP ip-172-31-26-60.ec2.internal.1337 > nat-130-245-192-27.resnet.stonybrook.edu.44318: Flags [R.], seq 0, ack 2687153884, win 0, length 0
20:01:06.898917 IP nat-130-245-192-27.resnet.stonybrook.edu.37040 > ip-172-31-26-60.ec2.internal.1337: Flags [S], seq 1139078480, win 29200, options [mss 1386,sackOK,TS val 14849306 ecr 0,nop,wscale 6], length 0
20:01:06.898957 IP ip-172-31-26-60.ec2.internal.1337 > nat-130-245-192-27.resnet.stonybrook.edu.37040: Flags [R.], seq 0, ack 1139078481, win 0, length 0
20:01:07.078531 IP nat-130-245-192-27.resnet.stonybrook.edu.15788 > ip-172-31-26-60.ec2.internal.1337: Flags [S], seq 1116889347, win 29200, options [mss 1386,sackOK,TS val 14849320 ecr 0,nop,wscale 6], length 0
20:01:07.078569 IP ip-172-31-26-60.ec2.internal.1337 > nat-130-245-192-27.resnet.stonybrook.edu.15788: Flags [R.], seq 0, ack 1116889348, win 0, length 0
20:01:07.923121 IP nat-130-245-192-27.resnet.stonybrook.edu.27659 > ip-172-31-26-60.ec2.internal.1337: Flags [S], seq 1130719358, win 29200, options [mss 1386,sackOK,TS val 14849409 ecr 0,nop,wscale 6], length 0
20:01:07.923160 IP ip-172-31-26-60.ec2.internal.1337 > nat-130-245-192-27.resnet.stonybrook.edu.27659: Flags [R.], seq 0, ack 1130719359, win 0, length 0
20:01:08.136327 IP nat-130-245-192-27.resnet.stonybrook.edu.22540 > ip-172-31-26-60.ec2.internal.1337: Flags [S], seq 3231010642, win 29200, options [mss 1386,sackOK,TS val 14849427 ecr 0,nop,wscale 6], length 0
20:01:08.136365 IP ip-172-31-26-60.ec2.internal.1337 > nat-130-245-192-27.resnet.stonybrook.edu.22540: Flags [R.], seq 0, ack 3231010643, win 0, length 0
20:01:08.952942 IP nat-130-245-192-27.resnet.stonybrook.edu.17060 > ip-172-31-26-60.ec2.internal.1337: Flags [S], seq 557995102, win 29200, options [mss 1386,sackOK,TS val 14849511 ecr 0,nop,wscale 6], length 0
20:01:08.952979 IP ip-172-31-26-60.ec2.internal.1337 > nat-130-245-192-27.resnet.stonybrook.edu.17060: Flags [R.], seq 0, ack 557995103, win 0, length 0
20:01:09.173597 IP nat-130-245-192-27.resnet.stonybrook.edu.34560 > ip-172-31-26-60.ec2.internal.1337: Flags [S], seq 2497411321, win 29200, options [mss 1386,sackOK,TS val 14849533 ecr 0,nop,wscale 6], length 0
20:01:09.173634 IP ip-172-31-26-60.ec2.internal.1337 > nat-130-245-192-27.resnet.stonybrook.edu.34560: Flags [R.], seq 0, ack 2497411322, win 0, length 0
20:01:10.010636 IP nat-130-245-192-27.resnet.stonybrook.edu.4104 > ip-172-31-26-60.ec2.internal.1337: Flags [S], seq 1494911733, win 29200, options [mss 1386,sackOK,TS val 14849614 ecr 0,nop,wscale 6], length 0
20:01:10.010673 IP ip-172-31-26-60.ec2.internal.1337 > nat-130-245-192-27.resnet.stonybrook.edu.4104: Flags [R.], seq 0, ack 1494911734, win 0, length 0
20:01:10.201325 IP nat-130-245-192-27.resnet.stonybrook.edu.5001 > ip-172-31-26-60.ec2.internal.1337: Flags [S], seq 3660387126, win 29200, options [mss 1386,sackOK,TS val 14849636 ecr 0,nop,wscale 6], length 0
20:01:10.201363 IP ip-172-31-26-60.ec2.internal.1337 > nat-130-245-192-27.resnet.stonybrook.edu.5001: Flags [R.], seq 0, ack 3660387127, win 0, length 0
20:01:11.050501 IP nat-130-245-192-27.resnet.stonybrook.edu.15369 > ip-172-31-26-60.ec2.internal.1337: Flags [S], seq 2956818407, win 29200, options [mss 1386,sackOK,TS val 14849721 ecr 0,nop,wscale 6], length 0
20:01:11.050538 IP ip-172-31-26-60.ec2.internal.1337 > nat-130-245-192-27.resnet.stonybrook.edu.15369: Flags [R.], seq 0, ack 2956818408, win 0, length 0
20:01:11.224321 IP nat-130-245-192-27.resnet.stonybrook.edu.17211 > ip-172-31-26-60.ec2.internal.1337: Flags [S], seq 1120573836, win 29200, options [mss 1386,sackOK,TS val 14849739 ecr 0,nop,wscale 6], length 0
20:01:11.224359 IP ip-172-31-26-60.ec2.internal.1337 > nat-130-245-192-27.resnet.stonybrook.edu.17211: Flags [R.], seq 0, ack 1120573837, win 0, length 0
20:01:11.906654 ARP, Request who-has ip-172-31-16-1.ec2.internal tell ip-172-31-26-60.ec2.internal, length 28
20:01:11.906781 ARP, Reply ip-172-31-16-1.ec2.internal is-at 0e:1f:97:af:d1:ce (oui Unknown), length 42
20:01:12.077382 IP nat-130-245-192-27.resnet.stonybrook.edu.31304 > ip-172-31-26-60.ec2.internal.1337: Flags [S], seq 1474173827, win 29200, options [mss 1386,sackOK,TS val 14849824 ecr 0,nop,wscale 6], length 0
20:01:12.077422 IP ip-172-31-26-60.ec2.internal.1337 > nat-130-245-192-27.resnet.stonybrook.edu.31304: Flags [R.], seq 0, ack 1474173828, win 0, length 0
20:01:12.250507 IP nat-130-245-192-27.resnet.stonybrook.edu.24667 > ip-172-31-26-60.ec2.internal.1337: Flags [S], seq 4141062178, win 29200, options [mss 1386,sackOK,TS val 14849841 ecr 0,nop,wscale 6], length 0
20:01:12.250543 IP ip-172-31-26-60.ec2.internal.1337 > nat-130-245-192-27.resnet.stonybrook.edu.24667: Flags [R.], seq 0, ack 4141062179, win 0, length 0
20:01:12.666753 IP ip-172-31-26-60.ec2.internal.52156 > ip-172-31-0-2.ec2.internal.domain: 52225+ PTR? 1.16.31.172.in-addr.arpa. (42)
20:01:12.668410 IP ip-172-31-0-2.ec2.internal.domain > ip-172-31-26-60.ec2.internal.52156: 52225 1/0/0 PTR ip-172-31-16-1.ec2.internal. (83)
20:01:13.104070 IP nat-130-245-192-27.resnet.stonybrook.edu.30846 > ip-172-31-26-60.ec2.internal.1337: Flags [S], seq 1698396583, win 29200, options [mss 1386,sackOK,TS val 14849927 ecr 0,nop,wscale 6], length 0
20:01:13.104109 IP ip-172-31-26-60.ec2.internal.1337 > nat-130-245-192-27.resnet.stonybrook.edu.30846: Flags [R.], seq 0, ack 1698396584, win 0, length 0
20:01:13.274816 IP nat-130-245-192-27.resnet.stonybrook.edu.3731 > ip-172-31-26-60.ec2.internal.1337: Flags [S], seq 2535840017, win 29200, options [mss 1386,sackOK,TS val 14849944 ecr 0,nop,wscale 6], length 0
20:01:13.274853 IP ip-172-31-26-60.ec2.internal.1337 > nat-130-245-192-27.resnet.stonybrook.edu.3731: Flags [R.], seq 0, ack 2535840018, win 0, length 0
20:01:14.145196 IP nat-130-245-192-27.resnet.stonybrook.edu.17150 > ip-172-31-26-60.ec2.internal.1337: Flags [S], seq 151048506, win 29200, options [mss 1386,sackOK,TS val 14850029 ecr 0,nop,wscale 6], length 0
20:01:14.145234 IP ip-172-31-26-60.ec2.internal.1337 > nat-130-245-192-27.resnet.stonybrook.edu.17150: Flags [R.], seq 0, ack 151048507, win 0, length 0
20:01:14.328964 IP nat-130-245-192-27.resnet.stonybrook.edu.13091 > ip-172-31-26-60.ec2.internal.1337: Flags [S], seq 3719173797, win 29200, options [mss 1386,sackOK,TS val 14850046 ecr 0,nop,wscale 6], length 0
20:01:14.329003 IP ip-172-31-26-60.ec2.internal.1337 > nat-130-245-192-27.resnet.stonybrook.edu.13091: Flags [R.], seq 0, ack 3719173798, win 0, length 0
20:01:15.171720 IP nat-130-245-192-27.resnet.stonybrook.edu.44176 > ip-172-31-26-60.ec2.internal.1337: Flags [S], seq 2520958516, win 29200, options [mss 1386,sackOK,TS val 14850134 ecr 0,nop,wscale 6], length 0
20:01:15.171762 IP ip-172-31-26-60.ec2.internal.1337 > nat-130-245-192-27.resnet.stonybrook.edu.44176: Flags [R.], seq 0, ack 2520958517, win 0, length 0
20:01:15.354089 IP nat-130-245-192-27.resnet.stonybrook.edu.13190 > ip-172-31-26-60.ec2.internal.1337: Flags [S], seq 84078536, win 29200, options [mss 1386,sackOK,TS val 14850152 ecr 0,nop,wscale 6], length 0
20:01:15.354126 IP ip-172-31-26-60.ec2.internal.1337 > nat-130-245-192-27.resnet.stonybrook.edu.13190: Flags [R.], seq 0, ack 84078537, win 0, length 0
20:01:16.195225 IP nat-130-245-192-27.resnet.stonybrook.edu.25276 > ip-172-31-26-60.ec2.internal.1337: Flags [S], seq 862870320, win 29200, options [mss 1386,sackOK,TS val 14850236 ecr 0,nop,wscale 6], length 0
20:01:16.195262 IP ip-172-31-26-60.ec2.internal.1337 > nat-130-245-192-27.resnet.stonybrook.edu.25276: Flags [R.], seq 0, ack 862870321, win 0, length 0
20:01:16.232387 ARP, Request who-has ip-172-31-26-60.ec2.internal tell ip-172-31-16-1.ec2.internal, length 42
20:01:16.232394 ARP, Reply ip-172-31-26-60.ec2.internal is-at 0e:a0:35:c7:a9:ac (oui Unknown), length 28
20:01:16.377016 IP nat-130-245-192-27.resnet.stonybrook.edu.22031 > ip-172-31-26-60.ec2.internal.1337: Flags [S], seq 883022278, win 29200, options [mss 1386,sackOK,TS val 14850254 ecr 0,nop,wscale 6], length 0
20:01:16.377052 IP ip-172-31-26-60.ec2.internal.1337 > nat-130-245-192-27.resnet.stonybrook.edu.22031: Flags [R.], seq 0, ack 883022279, win 0, length 0
20:01:17.217438 IP nat-130-245-192-27.resnet.stonybrook.edu.16879 > ip-172-31-26-60.ec2.internal.1337: Flags [S], seq 3788153631, win 29200, options [mss 1386,sackOK,TS val 14850338 ecr 0,nop,wscale 6], length 0
20:01:17.217479 IP ip-172-31-26-60.ec2.internal.1337 > nat-130-245-192-27.resnet.stonybrook.edu.16879: Flags [R.], seq 0, ack 3788153632, win 0, length 0
20:01:17.452556 IP nat-130-245-192-27.resnet.stonybrook.edu.29026 > ip-172-31-26-60.ec2.internal.1337: Flags [S], seq 1651474247, win 29200, options [mss 1386,sackOK,TS val 14850361 ecr 0,nop,wscale 6], length 0
20:01:17.452599 IP ip-172-31-26-60.ec2.internal.1337 > nat-130-245-192-27.resnet.stonybrook.edu.29026: Flags [R.], seq 0, ack 1651474248, win 0, length 0
20:01:18.242847 IP nat-130-245-192-27.resnet.stonybrook.edu.43456 > ip-172-31-26-60.ec2.internal.1337: Flags [S], seq 2584962024, win 29200, options [mss 1386,sackOK,TS val 14850441 ecr 0,nop,wscale 6], length 0
20:01:18.242885 IP ip-172-31-26-60.ec2.internal.1337 > nat-130-245-192-27.resnet.stonybrook.edu.43456: Flags [R.], seq 0, ack 2584962025, win 0, length 0
20:01:18.481136 IP nat-130-245-192-27.resnet.stonybrook.edu.23623 > ip-172-31-26-60.ec2.internal.1337: Flags [S], seq 3175323944, win 29200, options [mss 1386,sackOK,TS val 14850464 ecr 0,nop,wscale 6], length 0
20:01:18.481175 IP ip-172-31-26-60.ec2.internal.1337 > nat-130-245-192-27.resnet.stonybrook.edu.23623: Flags [R.], seq 0, ack 3175323945, win 0, length 0
20:01:19.297053 IP nat-130-245-192-27.resnet.stonybrook.edu.30664 > ip-172-31-26-60.ec2.internal.1337: Flags [S], seq 2868542939, win 29200, options [mss 1386,sackOK,TS val 14850543 ecr 0,nop,wscale 6], length 0
20:01:19.297090 IP ip-172-31-26-60.ec2.internal.1337 > nat-130-245-192-27.resnet.stonybrook.edu.30664: Flags [R.], seq 0, ack 2868542940, win 0, length 0
20:01:19.504268 IP nat-130-245-192-27.resnet.stonybrook.edu.10512 > ip-172-31-26-60.ec2.internal.1337: Flags [S], seq 1057419667, win 29200, options [mss 1386,sackOK,TS val 14850567 ecr 0,nop,wscale 6], length 0
20:01:19.504304 IP ip-172-31-26-60.ec2.internal.1337 > nat-130-245-192-27.resnet.stonybrook.edu.10512: Flags [R.], seq 0, ack 1057419668, win 0, length 0
20:01:20.324120 IP nat-130-245-192-27.resnet.stonybrook.edu.14597 > ip-172-31-26-60.ec2.internal.1337: Flags [S], seq 115718147, win 29200, options [mss 1386,sackOK,TS val 14850649 ecr 0,nop,wscale 6], length 0
20:01:20.324158 IP ip-172-31-26-60.ec2.internal.1337 > nat-130-245-192-27.resnet.stonybrook.edu.14597: Flags [R.], seq 0, ack 115718148, win 0, length 0
20:01:20.565690 IP nat-130-245-192-27.resnet.stonybrook.edu.33085 > ip-172-31-26-60.ec2.internal.1337: Flags [S], seq 1072393835, win 29200, options [mss 1386,sackOK,TS val 14850673 ecr 0,nop,wscale 6], length 0
20:01:20.565727 IP ip-172-31-26-60.ec2.internal.1337 > nat-130-245-192-27.resnet.stonybrook.edu.33085: Flags [R.], seq 0, ack 1072393836, win 0, length 0
20:01:21.346984 IP nat-130-245-192-27.resnet.stonybrook.edu.18192 > ip-172-31-26-60.ec2.internal.1337: Flags [S], seq 603261065, win 29200, options [mss 1386,sackOK,TS val 14850751 ecr 0,nop,wscale 6], length 0
20:01:21.347037 IP ip-172-31-26-60.ec2.internal.1337 > nat-130-245-192-27.resnet.stonybrook.edu.18192: Flags [R.], seq 0, ack 603261066, win 0, length 0
20:01:21.610437 IP nat-130-245-192-27.resnet.stonybrook.edu.19130 > ip-172-31-26-60.ec2.internal.1337: Flags [S], seq 1383903456, win 29200, options [mss 1386,sackOK,TS val 14850775 ecr 0,nop,wscale 6], length 0
20:01:21.610475 IP ip-172-31-26-60.ec2.internal.1337 > nat-130-245-192-27.resnet.stonybrook.edu.19130: Flags [R.], seq 0, ack 1383903457, win 0, length 0
20:01:22.374388 IP nat-130-245-192-27.resnet.stonybrook.edu.40872 > ip-172-31-26-60.ec2.internal.1337: Flags [S], seq 665601347, win 29200, options [mss 1386,sackOK,TS val 14850854 ecr 0,nop,wscale 6], length 0
20:01:22.374424 IP ip-172-31-26-60.ec2.internal.1337 > nat-130-245-192-27.resnet.stonybrook.edu.40872: Flags [R.], seq 0, ack 665601348, win 0, length 0
20:01:22.637832 IP nat-130-245-192-27.resnet.stonybrook.edu.25787 > ip-172-31-26-60.ec2.internal.1337: Flags [S], seq 2383320824, win 29200, options [mss 1386,sackOK,TS val 14850880 ecr 0,nop,wscale 6], length 0
20:01:22.637882 IP ip-172-31-26-60.ec2.internal.1337 > nat-130-245-192-27.resnet.stonybrook.edu.25787: Flags [R.], seq 0, ack 2383320825, win 0, length 0
20:01:23.396271 IP nat-130-245-192-27.resnet.stonybrook.edu.36031 > ip-172-31-26-60.ec2.internal.1337: Flags [S], seq 81111594, win 29200, options [mss 1386,sackOK,TS val 14850956 ecr 0,nop,wscale 6], length 0
20:01:23.396309 IP ip-172-31-26-60.ec2.internal.1337 > nat-130-245-192-27.resnet.stonybrook.edu.36031: Flags [R.], seq 0, ack 81111595, win 0, length 0
20:01:23.662233 IP nat-130-245-192-27.resnet.stonybrook.edu.40436 > ip-172-31-26-60.ec2.internal.1337: Flags [S], seq 4283715212, win 29200, options [mss 1386,sackOK,TS val 14850983 ecr 0,nop,wscale 6], length 0
20:01:23.662283 IP ip-172-31-26-60.ec2.internal.1337 > nat-130-245-192-27.resnet.stonybrook.edu.40436: Flags [R.], seq 0, ack 4283715213, win 0, length 0
20:01:24.418093 IP nat-130-245-192-27.resnet.stonybrook.edu.38570 > ip-172-31-26-60.ec2.internal.1337: Flags [S], seq 2779099725, win 29200, options [mss 1386,sackOK,TS val 14851058 ecr 0,nop,wscale 6], length 0
20:01:24.418130 IP ip-172-31-26-60.ec2.internal.1337 > nat-130-245-192-27.resnet.stonybrook.edu.38570: Flags [R.], seq 0, ack 2779099726, win 0, length 0
20:01:24.695676 IP nat-130-245-192-27.resnet.stonybrook.edu.36559 > ip-172-31-26-60.ec2.internal.1337: Flags [S], seq 3255271474, win 29200, options [mss 1386,sackOK,TS val 14851085 ecr 0,nop,wscale 6], length 0
20:01:24.695713 IP ip-172-31-26-60.ec2.internal.1337 > nat-130-245-192-27.resnet.stonybrook.edu.36559: Flags [R.], seq 0, ack 3255271475, win 0, length 0
20:01:25.440529 IP nat-130-245-192-27.resnet.stonybrook.edu.26255 > ip-172-31-26-60.ec2.internal.1337: Flags [S], seq 2284971201, win 29200, options [mss 1386,sackOK,TS val 14851160 ecr 0,nop,wscale 6], length 0
20:01:25.440567 IP ip-172-31-26-60.ec2.internal.1337 > nat-130-245-192-27.resnet.stonybrook.edu.26255: Flags [R.], seq 0, ack 2284971202, win 0, length 0
20:01:25.730736 IP nat-130-245-192-27.resnet.stonybrook.edu.21415 > ip-172-31-26-60.ec2.internal.1337: Flags [S], seq 1154145334, win 29200, options [mss 1386,sackOK,TS val 14851188 ecr 0,nop,wscale 6], length 0
20:01:25.730774 IP ip-172-31-26-60.ec2.internal.1337 > nat-130-245-192-27.resnet.stonybrook.edu.21415: Flags [R.], seq 0, ack 1154145335, win 0, length 0
20:01:26.476619 IP nat-130-245-192-27.resnet.stonybrook.edu.34516 > ip-172-31-26-60.ec2.internal.1337: Flags [S], seq 3768695620, win 29200, options [mss 1386,sackOK,TS val 14851263 ecr 0,nop,wscale 6], length 0
20:01:26.476656 IP ip-172-31-26-60.ec2.internal.1337 > nat-130-245-192-27.resnet.stonybrook.edu.34516: Flags [R.], seq 0, ack 3768695621, win 0, length 0
20:01:26.755354 IP nat-130-245-192-27.resnet.stonybrook.edu.11284 > ip-172-31-26-60.ec2.internal.1337: Flags [S], seq 532549680, win 29200, options [mss 1386,sackOK,TS val 14851292 ecr 0,nop,wscale 6], length 0
20:01:26.755391 IP ip-172-31-26-60.ec2.internal.1337 > nat-130-245-192-27.resnet.stonybrook.edu.11284: Flags [R.], seq 0, ack 532549681, win 0, length 0
20:01:27.501909 IP nat-130-245-192-27.resnet.stonybrook.edu.22479 > ip-172-31-26-60.ec2.internal.1337: Flags [S], seq 778864498, win 29200, options [mss 1386,sackOK,TS val 14851367 ecr 0,nop,wscale 6], length 0
20:01:27.501945 IP ip-172-31-26-60.ec2.internal.1337 > nat-130-245-192-27.resnet.stonybrook.edu.22479: Flags [R.], seq 0, ack 778864499, win 0, length 0
20:01:27.830612 IP nat-130-245-192-27.resnet.stonybrook.edu.24969 > ip-172-31-26-60.ec2.internal.1337: Flags [S], seq 1156279595, win 29200, options [mss 1386,sackOK,TS val 14851399 ecr 0,nop,wscale 6], length 0
20:01:27.830650 IP ip-172-31-26-60.ec2.internal.1337 > nat-130-245-192-27.resnet.stonybrook.edu.24969: Flags [R.], seq 0, ack 1156279596, win 0, length 0
20:01:28.550619 IP nat-130-245-192-27.resnet.stonybrook.edu.9581 > ip-172-31-26-60.ec2.internal.1337: Flags [S], seq 2515100956, win 29200, options [mss 1386,sackOK,TS val 14851469 ecr 0,nop,wscale 6], length 0
20:01:28.550657 IP ip-172-31-26-60.ec2.internal.1337 > nat-130-245-192-27.resnet.stonybrook.edu.9581: Flags [R.], seq 0, ack 2515100957, win 0, length 0
20:01:28.856790 IP nat-130-245-192-27.resnet.stonybrook.edu.24677 > ip-172-31-26-60.ec2.internal.1337: Flags [S], seq 4183362538, win 29200, options [mss 1386,sackOK,TS val 14851502 ecr 0,nop,wscale 6], length 0
20:01:28.856828 IP ip-172-31-26-60.ec2.internal.1337 > nat-130-245-192-27.resnet.stonybrook.edu.24677: Flags [R.], seq 0, ack 4183362539, win 0, length 0
20:01:29.577075 IP nat-130-245-192-27.resnet.stonybrook.edu.16071 > ip-172-31-26-60.ec2.internal.1337: Flags [S], seq 2548148124, win 29200, options [mss 1386,sackOK,TS val 14851574 ecr 0,nop,wscale 6], length 0
20:01:29.577113 IP ip-172-31-26-60.ec2.internal.1337 > nat-130-245-192-27.resnet.stonybrook.edu.16071: Flags [R.], seq 0, ack 2548148125, win 0, length 0
20:01:29.894273 IP nat-130-245-192-27.resnet.stonybrook.edu.27280 > ip-172-31-26-60.ec2.internal.1337: Flags [S], seq 3681830249, win 29200, options [mss 1386,sackOK,TS val 14851606 ecr 0,nop,wscale 6], length 0
20:01:29.894309 IP ip-172-31-26-60.ec2.internal.1337 > nat-130-245-192-27.resnet.stonybrook.edu.27280: Flags [R.], seq 0, ack 3681830250, win 0, length 0
20:01:30.611097 IP nat-130-245-192-27.resnet.stonybrook.edu.34882 > ip-172-31-26-60.ec2.internal.1337: Flags [S], seq 332844742, win 29200, options [mss 1386,sackOK,TS val 14851677 ecr 0,nop,wscale 6], length 0
20:01:30.611134 IP ip-172-31-26-60.ec2.internal.1337 > nat-130-245-192-27.resnet.stonybrook.edu.34882: Flags [R.], seq 0, ack 332844743, win 0, length 0
20:01:30.917330 IP nat-130-245-192-27.resnet.stonybrook.edu.8713 > ip-172-31-26-60.ec2.internal.1337: Flags [S], seq 3833864279, win 29200, options [mss 1386,sackOK,TS val 14851708 ecr 0,nop,wscale 6], length 0
20:01:30.917367 IP ip-172-31-26-60.ec2.internal.1337 > nat-130-245-192-27.resnet.stonybrook.edu.8713: Flags [R.], seq 0, ack 3833864280, win 0, length 0
20:01:31.634309 IP nat-130-245-192-27.resnet.stonybrook.edu.6501 > ip-172-31-26-60.ec2.internal.1337: Flags [S], seq 2993228071, win 29200, options [mss 1386,sackOK,TS val 14851780 ecr 0,nop,wscale 6], length 0
20:01:31.634348 IP ip-172-31-26-60.ec2.internal.1337 > nat-130-245-192-27.resnet.stonybrook.edu.6501: Flags [R.], seq 0, ack 2993228072, win 0, length 0
20:01:31.950274 IP nat-130-245-192-27.resnet.stonybrook.edu.32125 > ip-172-31-26-60.ec2.internal.1337: Flags [S], seq 2940758503, win 29200, options [mss 1386,sackOK,TS val 14851811 ecr 0,nop,wscale 6], length 0
20:01:31.950312 IP ip-172-31-26-60.ec2.internal.1337 > nat-130-245-192-27.resnet.stonybrook.edu.32125: Flags [R.], seq 0, ack 2940758504, win 0, length 0
20:01:32.218418 ARP, Request who-has ip-172-31-26-60.ec2.internal tell ip-172-31-16-1.ec2.internal, length 42
20:01:32.218436 ARP, Reply ip-172-31-26-60.ec2.internal is-at 0e:a0:35:c7:a9:ac (oui Unknown), length 28
20:01:32.682646 IP nat-130-245-192-27.resnet.stonybrook.edu.21986 > ip-172-31-26-60.ec2.internal.1337: Flags [S], seq 2344426573, win 29200, options [mss 1386,sackOK,TS val 14851882 ecr 0,nop,wscale 6], length 0
20:01:32.682683 IP ip-172-31-26-60.ec2.internal.1337 > nat-130-245-192-27.resnet.stonybrook.edu.21986: Flags [R.], seq 0, ack 2344426574, win 0, length 0
20:01:32.979582 IP nat-130-245-192-27.resnet.stonybrook.edu.18243 > ip-172-31-26-60.ec2.internal.1337: Flags [S], seq 146600269, win 29200, options [mss 1386,sackOK,TS val 14851914 ecr 0,nop,wscale 6], length 0
20:01:32.979619 IP ip-172-31-26-60.ec2.internal.1337 > nat-130-245-192-27.resnet.stonybrook.edu.18243: Flags [R.], seq 0, ack 146600270, win 0, length 0
20:01:33.717646 IP nat-130-245-192-27.resnet.stonybrook.edu.25334 > ip-172-31-26-60.ec2.internal.1337: Flags [S], seq 2391762262, win 29200, options [mss 1386,sackOK,TS val 14851987 ecr 0,nop,wscale 6], length 0
20:01:33.717684 IP ip-172-31-26-60.ec2.internal.1337 > nat-130-245-192-27.resnet.stonybrook.edu.25334: Flags [R.], seq 0, ack 2391762263, win 0, length 0
20:01:34.014489 IP nat-130-245-192-27.resnet.stonybrook.edu.24191 > ip-172-31-26-60.ec2.internal.1337: Flags [S], seq 2602611283, win 29200, options [mss 1386,sackOK,TS val 14852017 ecr 0,nop,wscale 6], length 0
20:01:34.014529 IP ip-172-31-26-60.ec2.internal.1337 > nat-130-245-192-27.resnet.stonybrook.edu.24191: Flags [R.], seq 0, ack 2602611284, win 0, length 0
20:01:34.744025 IP nat-130-245-192-27.resnet.stonybrook.edu.16173 > ip-172-31-26-60.ec2.internal.1337: Flags [S], seq 1215567498, win 29200, options [mss 1386,sackOK,TS val 14852091 ecr 0,nop,wscale 6], length 0
20:01:34.744071 IP ip-172-31-26-60.ec2.internal.1337 > nat-130-245-192-27.resnet.stonybrook.edu.16173: Flags [R.], seq 0, ack 1215567499, win 0, length 0
20:01:35.041390 IP nat-130-245-192-27.resnet.stonybrook.edu.33775 > ip-172-31-26-60.ec2.internal.1337: Flags [S], seq 1103146764, win 29200, options [mss 1386,sackOK,TS val 14852120 ecr 0,nop,wscale 6], length 0
20:01:35.041427 IP ip-172-31-26-60.ec2.internal.1337 > nat-130-245-192-27.resnet.stonybrook.edu.33775: Flags [R.], seq 0, ack 1103146765, win 0, length 0
20:01:35.772914 IP nat-130-245-192-27.resnet.stonybrook.edu.35020 > ip-172-31-26-60.ec2.internal.1337: Flags [S], seq 3319409584, win 29200, options [mss 1386,sackOK,TS val 14852194 ecr 0,nop,wscale 6], length 0
20:01:35.772952 IP ip-172-31-26-60.ec2.internal.1337 > nat-130-245-192-27.resnet.stonybrook.edu.35020: Flags [R.], seq 0, ack 3319409585, win 0, length 0
